{
  "unit": "hoa_12",
  "subject": "hoa",
  "subject_name": "Hoá học",
  "grade": 12,
  "files": [
    {
      "file": "SGK HOA HOC 12 - KNTT.pdf",
      "volume": null,
      "page_count": 147,
      "printed_offset": 2
    }
  ],
  "toc": [
    {
      "id": "huong-dan",
      "role": "front_matter",
      "kind": "huong_dan",
      "label": null,
      "number": null,
      "title": "Hướng dẫn sử dụng sách",
      "file": null,
      "source_file": "SGK HOA HOC 12 - KNTT.pdf",
      "pdf_pages": [
        4,
        4
      ],
      "status": "skip"
    },
    {
      "id": "loi-noi-dau",
      "role": "front_matter",
      "kind": "loi_noi_dau",
      "label": null,
      "number": null,
      "title": "Lời nói đầu",
      "file": null,
      "source_file": "SGK HOA HOC 12 - KNTT.pdf",
      "pdf_pages": [
        5,
        5
      ],
      "status": "skip"
    },
    {
      "id": "muc-luc",
      "role": "front_matter",
      "kind": "muc_luc",
      "label": null,
      "number": null,
      "title": "Mục lục",
      "file": null,
      "source_file": "SGK HOA HOC 12 - KNTT.pdf",
      "pdf_pages": [
        6,
        7
      ],
      "status": "skip"
    },
    {
      "id": "c01",
      "role": "group",
      "kind": "chuong",
      "label": "Chương 1",
      "number": 1,
      "title": "Ester – Lipid",
      "dir": "Chuong-01-Ester-Lipid",
      "children": [
        {
          "id": "b01",
          "role": "lesson",
          "kind": "bai",
          "label": "Bài 1",
          "number": 1,
          "title": "Ester – Lipid",
          "lesson_type": "ly_thuyet",
          "file": "B01-Ester-Lipid.md",
          "source_file": "SGK HOA HOC 12 - KNTT.pdf",
          "pdf_pages": [
            8,
            15
          ],
          "status": "layer2"
        },
        {
          "id": "b02",
          "role": "lesson",
          "kind": "bai",
          "label": "Bài 2",
          "number": 2,
          "title": "Xà phòng và chất giặt rửa",
          "lesson_type": "ly_thuyet",
          "file": "B02-Xa-phong-va-chat-giat-rua.md",
          "source_file": "SGK HOA HOC 12 - KNTT.pdf",
          "pdf_pages": [
            16,
            19
          ],
          "status": "layer2"
        },
        {
          "id": "b03",
          "role": "lesson",
          "kind": "bai",
          "label": "Bài 3",
          "number": 3,
          "title": "Ôn tập chương 1",
          "lesson_type": "on_tap",
          "file": "B03-On-tap-chuong-1.md",
          "source_file": "SGK HOA HOC 12 - KNTT.pdf",
          "pdf_pages": [
            20,
            21
          ],
          "status": "layer2"
        }
      ]
    },
    {
      "id": "c02",
      "role": "group",
      "kind": "chuong",
      "label": "Chương 2",
      "number": 2,
      "title": "Carbohydrate",
      "dir": "Chuong-02-Carbohydrate",
      "children": [
        {
          "id": "b04",
          "role": "lesson",
          "kind": "bai",
          "label": "Bài 4",
          "number": 4,
          "title": "Giới thiệu về carbohydrate. Glucose và fructose",
          "lesson_type": "ly_thuyet",
          "file": "B04-Gioi-thieu-ve-carbohydrate-Glucose-va-fructose.md",
          "source_file": "SGK HOA HOC 12 - KNTT.pdf",
          "pdf_pages": [
            22,
            26
          ],
          "status": "layer2"
        },
        {
          "id": "b05",
          "role": "lesson",
          "kind": "bai",
          "label": "Bài 5",
          "number": 5,
          "title": "Saccharose và maltose",
          "lesson_type": "ly_thuyet",
          "file": "B05-Saccharose-va-maltose.md",
          "source_file": "SGK HOA HOC 12 - KNTT.pdf",
          "pdf_pages": [
            27,
            29
          ],
          "status": "layer2"
        },
        {
          "id": "b06",
          "role": "lesson",
          "kind": "bai",
          "label": "Bài 6",
          "number": 6,
          "title": "Tinh bột và cellulose",
          "lesson_type": "ly_thuyet",
          "file": "B06-Tinh-bot-va-cellulose.md",
          "source_file": "SGK HOA HOC 12 - KNTT.pdf",
          "pdf_pages": [
            30,
            34
          ],
          "status": "layer2"
        },
        {
          "id": "b07",
          "role": "lesson",
          "kind": "bai",
          "label": "Bài 7",
          "number": 7,
          "title": "Ôn tập chương 2",
          "lesson_type": "on_tap",
          "file": "B07-On-tap-chuong-2.md",
          "source_file": "SGK HOA HOC 12 - KNTT.pdf",
          "pdf_pages": [
            35,
            36
          ],
          "status": "layer2"
        }
      ]
    },
    {
      "id": "c03",
      "role": "group",
      "kind": "chuong",
      "label": "Chương 3",
      "number": 3,
      "title": "Hợp chất chứa nitrogen",
      "dir": "Chuong-03-Hop-chat-chua-nitrogen",
      "children": [
        {
          "id": "b08",
          "role": "lesson",
          "kind": "bai",
          "label": "Bài 8",
          "number": 8,
          "title": "Amine",
          "lesson_type": "ly_thuyet",
          "file": "B08-Amine.md",
          "source_file": "SGK HOA HOC 12 - KNTT.pdf",
          "pdf_pages": [
            37,
            42
          ],
          "status": "layer2"
        },
        {
          "id": "b09",
          "role": "lesson",
          "kind": "bai",
          "label": "Bài 9",
          "number": 9,
          "title": "Amino acid và peptide",
          "lesson_type": "ly_thuyet",
          "file": "B09-Amino-acid-va-peptide.md",
          "source_file": "SGK HOA HOC 12 - KNTT.pdf",
          "pdf_pages": [
            43,
            47
          ],
          "status": "layer2"
        },
        {
          "id": "b10",
          "role": "lesson",
          "kind": "bai",
          "label": "Bài 10",
          "number": 10,
          "title": "Protein và enzyme",
          "lesson_type": "ly_thuyet",
          "file": "B10-Protein-va-enzyme.md",
          "source_file": "SGK HOA HOC 12 - KNTT.pdf",
          "pdf_pages": [
            48,
            50
          ],
          "status": "layer2"
        },
        {
          "id": "b11",
          "role": "lesson",
          "kind": "bai",
          "label": "Bài 11",
          "number": 11,
          "title": "Ôn tập chương 3",
          "lesson_type": "on_tap",
          "file": "B11-On-tap-chuong-3.md",
          "source_file": "SGK HOA HOC 12 - KNTT.pdf",
          "pdf_pages": [
            51,
            52
          ],
          "status": "layer2"
        }
      ]
    },
    {
      "id": "c04",
      "role": "group",
      "kind": "chuong",
      "label": "Chương 4",
      "number": 4,
      "title": "Polymer",
      "dir": "Chuong-04-Polymer",
      "children": [
        {
          "id": "b12",
          "role": "lesson",
          "kind": "bai",
          "label": "Bài 12",
          "number": 12,
          "title": "Đại cương về polymer",
          "lesson_type": "ly_thuyet",
          "file": "B12-Dai-cuong-ve-polymer.md",
          "source_file": "SGK HOA HOC 12 - KNTT.pdf",
          "pdf_pages": [
            53,
            57
          ],
          "status": "layer2"
        },
        {
          "id": "b13",
          "role": "lesson",
          "kind": "bai",
          "label": "Bài 13",
          "number": 13,
          "title": "Vật liệu polymer",
          "lesson_type": "ly_thuyet",
          "file": "B13-Vat-lieu-polymer.md",
          "source_file": "SGK HOA HOC 12 - KNTT.pdf",
          "pdf_pages": [
            58,
            66
          ],
          "status": "layer2"
        },
        {
          "id": "b14",
          "role": "lesson",
          "kind": "bai",
          "label": "Bài 14",
          "number": 14,
          "title": "Ôn tập chương 4",
          "lesson_type": "on_tap",
          "file": "B14-On-tap-chuong-4.md",
          "source_file": "SGK HOA HOC 12 - KNTT.pdf",
          "pdf_pages": [
            67,
            68
          ],
          "status": "layer2"
        }
      ]
    },
    {
      "id": "c05",
      "role": "group",
      "kind": "chuong",
      "label": "Chương 5",
      "number": 5,
      "title": "Pin điện và điện phân",
      "dir": "Chuong-05-Pin-dien-va-dien-phan",
      "children": [
        {
          "id": "b15",
          "role": "lesson",
          "kind": "bai",
          "label": "Bài 15",
          "number": 15,
          "title": "Thế điện cực và nguồn điện hoá học",
          "lesson_type": "ly_thuyet",
          "file": "B15-The-dien-cuc-va-nguon-dien-hoa-hoc.md",
          "source_file": "SGK HOA HOC 12 - KNTT.pdf",
          "pdf_pages": [
            69,
            79
          ],
          "status": "layer2"
        },
        {
          "id": "b16",
          "role": "lesson",
          "kind": "bai",
          "label": "Bài 16",
          "number": 16,
          "title": "Điện phân",
          "lesson_type": "ly_thuyet",
          "file": "B16-Dien-phan.md",
          "source_file": "SGK HOA HOC 12 - KNTT.pdf",
          "pdf_pages": [
            80,
            86
          ],
          "status": "layer2"
        },
        {
          "id": "b17",
          "role": "lesson",
          "kind": "bai",
          "label": "Bài 17",
          "number": 17,
          "title": "Ôn tập chương 5",
          "lesson_type": "on_tap",
          "file": "B17-On-tap-chuong-5.md",
          "source_file": "SGK HOA HOC 12 - KNTT.pdf",
          "pdf_pages": [
            87,
            88
          ],
          "status": "layer2"
        }
      ]
    },
    {
      "id": "c06",
      "role": "group",
      "kind": "chuong",
      "label": "Chương 6",
      "number": 6,
      "title": "Đại cương về kim loại",
      "dir": "Chuong-06-Dai-cuong-ve-kim-loai",
      "children": [
        {
          "id": "b18",
          "role": "lesson",
          "kind": "bai",
          "label": "Bài 18",
          "number": 18,